sku,barcode,product_name,brand,price,image_url,main_cat,sub_cat,sub_cat2,target_surface,short_description,template_group,template_sub_type
Q2M-TOTR500M,8809973750811,GYEON QM Total Remover Balmumu Wax Cila Çözücü Koruma Sökücü - 500 ml,GYEON,650,https://mgpolishing.com/wp-content/uploads/2025/11/Q2M-TOTR500M_0.jpg,DIŞ YÜZEY,Yüzey Hazırlık ve Temizleyiciler,Boyalı Yüzey Temizleyiciler,"Araç boyası, cam, plastik, PPF, mat vernik",GYEON QM Total Remover 500 ml Balmumu Wax Cila Çözücü. MTS Kimya güvencesiyle güvenli alışveriş ve orijinal ürün garantisi.,paint_protection_quick,wax_remover
Q2M-TOTR1000M,8809973750835,GYEON QM Total Remover Balmumu Wax Cila Çözücü Koruma Sökücü - 1000 ml,GYEON,1050,https://mgpolishing.com/wp-content/uploads/2025/11/Q2M-TOTR1000M_0.jpg,DIŞ YÜZEY,Yüzey Hazırlık ve Temizleyiciler,Boyalı Yüzey Temizleyiciler,"Araç boyası, cam, plastik, PPF, mat vernik",GYEON QM Total Remover 1000 ml Balmumu Wax Cila Çözücü. MTS Kimya güvencesiyle orijinal ürün garantisi ve güvenli alışveriş imkanı.,paint_protection_quick,wax_remover
75182,8027486750528,FRA-BER Lustratouch Mum Bazlı Boya Koruyucu Ve Parlatıcı - 5 lt,FRA-BER,2300,https://mgpolishing.com/wp-content/uploads/2025/08/75182_1.webp,DIŞ YÜZEY,Boya Koruma Ürünleri,Wax ve Sprey Cilalar,"Araç boyası, vernik, tüm dış yüzeyler","FRA-BER Araç Yıkama, Temizlik, Koruma ve Bakım Ürünleri Yetkili Türkiye Distribütörü MTS Kimya. Orijinal Ürün Garantisi. Aynı Gün Hızlı Kargo.",paint_protection_quick,spray_wipe_sealant
74059,8027486816828,FRA-BER Lustrawax Nano Teknoloji Konsantre Koruyucu Cila - 1 lt,FRA-BER,1500,https://mgpolishing.com/wp-content/uploads/2025/11/74059_0.jpg,DIŞ YÜZEY,Boya Koruma Ürünleri,Durulama Cilaları,"Araç boyası, vernik, plastik, alüminyum","Premium Araç Yıkama Şampuanları, Hızlı Cilalar, Temizlik Ürünleri FRA-BER Yetkili Türkiye Distribütörü MTS Kimya’da. Orijinal Ürün Garantisi. Hızlı Kargo.",paint_protection_quick,spray_wipe_sealant
79295,8027486798162,INNOVACAR SC0 HYDRO SEALANT Hidrofobik Seramik Bazlı Nano Koruma - 500 ml,INNOVACAR,1100,https://mgpolishing.com/wp-content/uploads/2025/11/79295_0.jpg,DIŞ YÜZEY,Boya Koruma Ürünleri,Wax ve Sprey Cilalar,"Araç boyası, vernik, plastik, alüminyum - klasik araçlar dahil","İtalyan Premium Araç Yıkama, Temizlik, Koruma ve Bakım Ürünleri Yetkili Türkiye Distribütörü MTS Kimya. Orijinal Ürün Garantisi. Aynı Gün Hızlı Kargo.",paint_protection_quick,spray_wipe_sealant
700096,8027486806010,INNOVACAR SC1 SEALANT Hızlı Hidrofobik Seramik Bazlı Nano Koruma - 5 lt,INNOVACAR,9300,https://mgpolishing.com/wp-content/uploads/2025/11/700096_0.jpg,DIŞ YÜZEY,Boya Koruma Ürünleri,Wax ve Sprey Cilalar,"Araç boyası, tüm dış yüzeyler","İtalyan Premium Araç Yıkama, Temizlik, Koruma ve Bakım Ürünleri Yetkili Türkiye Distribütörü MTS Kimya. Orijinal Ürün Garantisi. Aynı Gün Hızlı Kargo.",paint_protection_quick,spray_wipe_sealant
373680,4030293148109,FLEX 14-2 150 Rotary Yüksek Torklu Polisaj Makinesi 1400W,FLEX,30000,https://mgpolishing.com/wp-content/uploads/2025/11/373680_0.jpg,MAKİNE-EKİPMAN,Polisaj Makineleri,Rotary Makineler,"Araç boyası, vernik, mermer, ahşap, marin yüzeyler","FLEX 14-3 150 rotary polisaj makinesi 1400 W; yüksek tork, 80-160 mm taban uyumu ve VR elektronik kontrolüyle detailing, kaporta-boya onarımı ve marin uygulamalarında profesyonel parlaklık sunar.",polisher_machine,corded_rotary_polisher
406813,4030293172791,FLEX 14-3 125 Rotary Polisaj Makinesi 1400W,FLEX,22500,https://mgpolishing.com/wp-content/uploads/2025/11/406813_0.jpeg,MAKİNE-EKİPMAN,Polisaj Makineleri,Rotary Makineler,"Araç boyası, vernik, mobilya yüzeyleri, marin uygulamaları","FLEX 14-3 125 Rotary Polisaj Makinesi, 1400W yüksek torklu motoru, VR mikroişlemci kontrolü ve ergonomik tasarımıyla profesyonel detaylandırma ve kaporta işlemleri için idealdir!",polisher_machine,corded_rotary_polisher
533019,4030293268593,FLEX PE 150 18-EC Set Rotary Çift Akülü Kablosuz Polisaj Makinesi Seti 18V -Kömürsüz Fırçasız Motor,FLEX,42500,https://mgpolishing.com/wp-content/uploads/2025/11/533019_0.jpeg,MAKİNE-EKİPMAN,Polisaj Makineleri,Kablosuz Makineler,"Araç boyası, vernik, marin yüzeyler, akrilik cam, endüstriyel yüzeyler","FLEX PE 150 18-EC Set Rotary Polisaj Makinesi, 18V çift akü, fırçasız motor ve CDC sabit elektronik sistemiyle kablosuz, güçlü ve hassas profesyonel polisaj deneyimi sunar!",polisher_machine,cordless_rotary_polisher
SGGF179,6973086160040,SGCB Rotary Yüksek Torklu Polisaj Makinesi 150mm 1200W,SGCB,12000,https://mgpolishing.com/wp-content/uploads/2025/11/SGGF179_0.jpg,MAKİNE-EKİPMAN,Polisaj Makineleri,Rotary Makineler,"Araç boyası, mermer, ahşap, marin yüzeyler, havacılık yüzeyleri","SGCB Rotary Yüksek Torklu Polisaj Makinesi, 150mm taban ve 1200W güçlü motoru ile düşük devirlerde bile yüksek tork sağlar. 6 kademeli hız ve titreşim önleme sistemiyle profesyonel kullanım!",polisher_machine,corded_rotary_polisher
SGGF189,6973086162297,SGCB Rotary Yüksek Torklu Polisaj Makinesi 75mm 710W,SGCB,11000,https://mgpolishing.com/wp-content/uploads/2025/11/SGGF189_0.jpg,MAKİNE-EKİPMAN,Polisaj Makineleri,Rotary Makineler,"Araç boyası - dar alanlar, ayna kapakları, kapı köşeleri, tampon detayları","SGCB Rotary Yüksek Torklu Polisaj Makinesi 75mm, 710W motoru ve çift dişli sistemiyle düşük devirlerde bile güçlü tork sağlar. 6 kademeli hız ayarıyla profesyonel polisaj için idealdir!",polisher_machine,corded_rotary_polisher
418072,4030293180550,FLEX XCE 10-8 125 Pozitif Sürüş Random Orbital Polisaj Makinesi 1010W (Gear Driven Dual Action),FLEX,28000,https://mgpolishing.com/wp-content/uploads/2025/08/418072_1.webp,MAKİNE-EKİPMAN,Polisaj Makineleri,Orbital Makineler,"Araç boyası, hassas/yumuşak boyalar, vernik, marin yüzeyler","FLEX XCE 10-8 125 Pozitif Sürüş Random Orbital Polisaj Makinesi, 1010W motoru ve 8 mm salınımıyla ağır kusurları hızla giderir, hologramsız finisaj sunar ve hassas boyalar için idealdir!",polisher_machine,forced_rotation_polisher
533020,4030293268609,FLEX XCE 8 150 18-EC Set DA Orbital Çift Akülü Kablosuz Polisaj Makinesi Seti - Pozitif Sürüş,FLEX,42500,https://mgpolishing.com/wp-content/uploads/2025/08/533020_1.webp,MAKİNE-EKİPMAN,Polisaj Makineleri,Kablosuz Makineler,"Araç boyası, hassas boyalar, vernik, marin yüzeyler, akrilik cam","FLEX XCE 8 150 18-EC Kablosuz Dual Action Polisaj Makinesi, rotary+orbital pozitif sürüş teknolojisi ve 8 mm salınımıyla ağır çizikleri hızla giderir, hologramsız finisaj sağlar!",polisher_machine,forced_rotation_polisher
447129,4030293196919,FLEX XFE 7-12 80 Orbital Polisaj Makinesi,FLEX,21000,https://mgpolishing.com/wp-content/uploads/2025/11/447129_0.jpeg,MAKİNE-EKİPMAN,Polisaj Makineleri,Orbital Makineler,"Araç boyası - dar alanlar, köşeler, detay bölgeleri, akrilik cam, marin yüzeyler","FLEX XFE 7-12 80 Orbital Polisaj Makinesi, 12 mm salınımı ve kompakt tasarımıyla dar alanlar ve bölgesel onarımlar için ideal, hologramsız profesyonel finisaj sağlar!",polisher_machine,da_polisher
418080,8683492660871,FLEX XFE 7-15 150 Orbital Çift Tabanlı Polisaj Makinesi Seti,FLEX,28000,https://mgpolishing.com/wp-content/uploads/2025/11/418080_0.jpeg,MAKİNE-EKİPMAN,Polisaj Makineleri,Orbital Makineler,"Araç boyası, hassas boyalar, vernik, marin yüzeyler","FLEX XFE 7-15 150 Orbital Polisaj Makinesi, 15 mm salınım ve serbest dönüş özelliğiyle hologramsız finisaj sağlar. Çift tabanlı setiyle profesyonel parlaklık için idealdir!",polisher_machine,da_polisher
533021,4030293268616,FLEX XFE 15 150 18-EC SET Random Orbital Çift Akülü Kablosuz Polisaj Makinesi Seti - Fırçasız Motor,FLEX,42000,https://mgpolishing.com/wp-content/uploads/2025/11/533021_0.jpg,MAKİNE-EKİPMAN,Polisaj Makineleri,Kablosuz Makineler,"Araç boyası, hassas boyalar, vernik, marin yüzeyler, akrilik cam","FLEX XFE 15 150 18-EC Kablosuz Orbital Polisaj Makinesi, 18V çift akü, 15 mm salınım ve fırçasız motoruyla hologramsız finisaj ve hafif çizik giderme için profesyonel performans sunar!",polisher_machine,da_polisher
SGGF181,6973086160064,SGCB Orbital Polisaj Makinesi 5&quot;/125mm 950W,SGCB,13000,https://mgpolishing.com/wp-content/uploads/2025/11/SGGF181_0.jpg,MAKİNE-EKİPMAN,Polisaj Makineleri,Orbital Makineler,"Araç boyası, mermer, ahşap zemin, marin yüzeyler, havacılık yüzeyleri","SGCB Orbital Polisaj Makinesi 125mm, 950W motoru ve 15mm salınımıyla düşük titreşimli, yumuşak başlatmalı ve 6 kademeli hız kontrolüyle profesyonel parlatma sağlar!",polisher_machine,da_polisher
SGGF190,6973086162303,SGCB Orbital Polisaj Makinesi 3&quot;/75mm 710W,SGCB,10500,https://mgpolishing.com/wp-content/uploads/2025/11/SGGF190_0.jpg,MAKİNE-EKİPMAN,Polisaj Makineleri,Orbital Makineler,"Araç boyası - dar alanlar, köşeler, detay bölgeleri, mermer, ahşap","SGCB Orbital Polisaj Makinesi 75mm, 710W gücü ve 12mm salınımıyla dar alanlarda yüksek kontrol sağlar. 6 kademeli hız, düşük titreşim ve ergonomik tasarımıyla profesyonel kullanım sunar!",polisher_machine,da_polisher
418102,4030293180581,FLEX PXE 80 10.8-EC Set Rotary/Orbital Akülü Nano Polisaj Makinesi Seti,FLEX,29500,https://mgpolishing.com/wp-content/uploads/2025/11/418102_0.jpg,MAKİNE-EKİPMAN,Polisaj Makineleri,Kablosuz Makineler,"Araç boyası - spot onarımlar, dar alanlar, köşeler, plastik trimler","FLEX PXE 80 10.8-EC Rotary/Orbital Akülü Nano Polisaj Makinesi, hızlı değişim sistemi, 3 12 mm salınım ve fırçasız motoruyla zımparalamadan finisaja kadar kusursuz sonuç sağlar!r",polisher_machine,mini_cordless_polisher
513547,4030293238213,"FLEX Pasta Cila Vidalama ve Temizlik Fırça Seti - PXE80 Mini Polisaj, DD 2G Şarjlı Matkap,3lü Fırça",FLEX,36500,https://mgpolishing.com/wp-content/uploads/2025/11/513547_0.jpg,MAKİNE-EKİPMAN,Polisaj Makineleri,Kablosuz Makineler,"Araç boyası, iç mekan kumaş ve plastikler, hassas yüzeyler","FLEX Pasta Cila, Vidalama ve Temizlik Seti; PXE 80 mini polisaj makinesi, DD 2G matkap ve 3’lü temizlik fırçasıyla detaylandırma, vidalama ve temizlik işlemleri için eksiksiz çözümdür!",polisher_machine,machine_kit
SGGF273,6973086165953,SGCB Kablosuz Şarjlı Rotary/Orbital Mini Nano Polisaj Makinesi Seti 12V – 65 Parça Fırçasız Motor,SGCB,16000,https://mgpolishing.com/wp-content/uploads/2025/08/SGGF273_1.webp,MAKİNE-EKİPMAN,Polisaj Makineleri,Kablosuz Makineler,"Araç boyası - dar alanlar, iç mekan plastikler, köşeler, trimler","SGCB Kablosuz Rotary/Orbital Mini Nano Polisaj Makinesi Seti, fırçasız motor, 12V çift akü ve 65 parçalı zengin aksesuar içeriğiyle profesyonel ve hassas parlatma sağlar!",polisher_machine,mini_cordless_polisher
447706,4030293197305,FLEX ORE 5-150 EC Random Orbital Zımpara Makinesi Elektrikli 400W,FLEX,20000,https://mgpolishing.com/wp-content/uploads/2025/11/447706_0.jpeg,MAKİNE-EKİPMAN,Zımpara Makineleri,,"Dolgulu yüzeyler, ahşap, metal, plastik","FLEX ORE 5-150 EC Random Orbital Zımpara Makinesi, 400W fırçasız motoru ve ayarlanabilir hız kontrolüyle profesyonel yüzey hazırlığı ve tozsuz zımparalama performansı sunar!",polisher_machine,sander
530632,4030293244726,FLEX OSE 2-70x198-EC Elektrikli Rende Orbital Zımpara Makinesi 260W - Avuç İçi Kömürsüz Hız Kontrol,FLEX,18500,https://mgpolishing.com/wp-content/uploads/2025/11/530632_0.jpg,MAKİNE-EKİPMAN,Zımpara Makineleri,,"Dolgulu yüzeyler, ahşap, metal - düz ve dar alanlar","FLEX OSE 2-70x198-EC Rende Orbital Zımpara Makinesi, 260W fırçasız motoru, düşük titreşimli ergonomik tasarımı ve hız kontrolüyle tozsuz ve hassas zımparalama sağlar!",polisher_machine,sander
516112,4030293236370,FLEX FS 140 Set PXE 80 İçin Esnek Uzatma Aparatı Seti,FLEX,17500,https://mgpolishing.com/wp-content/uploads/2025/11/516112_0.jpg,MAKİNE-EKİPMAN,Polisaj Makineleri,Uzatma Aparatları,Araç boyası - dar ve ulaşılması zor alanlar,"FLEX FS 140 PXE 80 Esnek Uzatma Aparatı, 140 cm uzunluğu ve aparatsız hızlı montaj sistemiyle dar ve ulaşılması zor alanlarda kusursuz polisaj kolaylığı sağlar!",polisher_machine,other
513547-01,8683492660925,"FLEX Şarjlı Vidalama ve Detaylı Temizlik Fırça Seti - DD 2G Matkap, 3lü Fırça (10.8V 2.5AH Akülü)",FLEX,15000,https://mgpolishing.com/wp-content/uploads/2025/11/513547-01_0.jpg,MAKİNE-EKİPMAN,Polisaj Makineleri,Kablosuz Makineler,"Kumaş, plastik, hassas yüzeyler + ahşap/metal (delme)","FLEX Şarjlı Vidalama ve Temizlik Seti, DD 2G matkap ve 3’lü matkap uyumlu fırça ile detaylı temizlik, vidalama ve delme işlemlerinde pratik ve güçlü bir çözüm sunar!",polisher_machine,mini_cordless_polisher
SGGC055,6973086161184,SGCB Tornador Detaylı Temizlik Tabancası Boncuklu - 1000 ml,SGCB,4000,https://mgpolishing.com/wp-content/uploads/2025/11/SGGC055_0.jpg,MAKİNE-EKİPMAN,Tornadorlar,,"Kumaş, halı, paspas, plastik trim, tavan döşemesi, fitil kenarları","SGCB Tornador Detaylı Temizlik Tabancası ile aracınızın iç ve dış aksamını derinlemesine temizleyin. Ergonomik tasarım, güçlü hava çıkışı ve 1L haznesiyle pratik kullanım!",polisher_machine,other
532579,4030293264199,FLEX HG 650 Profesyonel Sıcak Hava Tabancası 2000W - LCD Ekran Değişken Isı Hız Ayarlı,FLEX,8400,https://mgpolishing.com/wp-content/uploads/2025/11/532579_0.jpg,MAKİNE-EKİPMAN,Hava Tabancaları,,"PPF film, cam filmi, boya, yapışkan, plastik, metal bağlantılar","FLEX HG 650 Sıcak Hava Tabancası, 2000W gücü, 50°-650°C LCD sıcaklık kontrolü ve değişken hava akış ayarıyla folyo, boya, vernik ve kaplama söküm işlemlerinde profesyonel çözüm sunar!",polisher_machine,other
SGGC086,6973086160330,SGCB Air Blow Gun Yüksek Basınçlı Hava Tabancası,SGCB,400,https://mgpolishing.com/wp-content/uploads/2025/11/SGGC086_0.jpg,MAKİNE-EKİPMAN,Hava Tabancaları,,"Araç boyası, plastik trim, fitil kenarları, motor bölmesi, iç mekan","SGCB Air Blow Gun, yüksek basınçlı hava tabancası ile araç iç ve dış temizliğinde çizme karşıtı yumuşak uç, ergonomik tasarım ve 230 psi’ye kadar güçlü hava basıncı sunar!",polisher_machine,other
530537,4030293243774,FLEX BW Cordless Blower EC Akülü Hava Üfleyici Detay Seti,FLEX,20000,https://mgpolishing.com/wp-content/uploads/2025/11/530537_0.jpg,MAKİNE-EKİPMAN,Hava Tabancaları,,"Araç boyası, fitil kenarları, kapı araları, motor bölmesi, hassas elektronik","FLEX BW Cordless Blower EC Akülü Hava Üfleyici, 18V fırçasız motoru, 3 modlu hava üflemesi ve kompakt tasarımıyla boyalı yüzeyleri hızlı ve güvenli şekilde kurutmak için idealdir!",polisher_machine,mini_cordless_polisher
SGGS003,6973086165656,SCCB Kısa Nozul Hava Tabancası – Kompresör Basınçlı Hava Üfleyici – Air Blow Gun,SGCB,450,https://mgpolishing.com/wp-content/uploads/2025/08/SGGS003_1.webp,MAKİNE-EKİPMAN,Hava Tabancaları,,"Araç boyası, plastik trim, fitil kenarları, iç mekan, motor bölmesi","SGCB Kısa Nozul Hava Tabancası, güçlü hava akışı, ergonomik tasarım ve dayanıklı PA66 malzeme ile araç detaylandırma ve endüstriyel temizlik için ideal bir çözümdür!",polisher_machine,other
SGGS006,6973086165687,SCCB Uzun Nozul Hava Tabancası – Kompresör Basınçlı Hava Üfleyici – Air Blow Gun,SGCB,520,https://mgpolishing.com/wp-content/uploads/2025/08/SGGS006_1.webp,MAKİNE-EKİPMAN,Hava Tabancaları,,"Fitil araları, motor bölgesi, kapı cepleri, dar alanlar, iç mekan köşeleri","SGCB Uzun Nozul Hava Tabancası, güçlü hava akışı, ergonomik tasarım ve dayanıklı PA66 malzeme ile araç detaylandırma ve endüstriyel temizlik için mükemmel bir çözümdür!",polisher_machine,other
GRY4535,8683492660437,MG PS Pasta Süngeri 45/35 mm 5'li Paket (Gri) - Mini Polisaj Makinesi Uyumlu,MG PS,530,https://mgpolishing.com/wp-content/uploads/2025/08/GRY4535_1.webp,AKSESUAR,Polisaj Pedleri ve Keçeler,Orbital Süngerler,"Araç boyası - dar alanlar, köşeler, ayna kenarları, spoiler detayları",MG PADS Avrupa Üretimi Rotary Orbital Pasta Hare Hologram Süngerleri Cila Pedleri Yetkili Türkiye Dağıtıcısı. Orijinal Ürün Garantisi. Ücretsiz Kargo.,polisher_machine,mini_cordless_polisher
GPRO6555,8683492660444,MG PS Hare Giderici Cila Süngeri 65/55 mm 5'li Paket (Sarı)- Mini Polisaj Makinesi Uyumlu,MG PS,600,https://mgpolishing.com/wp-content/uploads/2025/11/GPRO6555_0.jpg,AKSESUAR,Polisaj Pedleri ve Keçeler,Orbital Süngerler,"Araç boyası - dar alanlar, köşeler, ayna kenarları, kapı kolları",MG PADS Her Polisaj Makinasına Uyumlu Rotary Orbital Pasta Hare Hologram Süngerleri Cila Pedleri Yetkili Türkiye Dağıtıcısı. Güvenli Alışveriş. Hızlı Kargo,polisher_machine,mini_cordless_polisher
GPRO4535,8683492660451,MG PS Hare Giderici Cila Süngeri 45/35 mm 5'li Paket (Sarı)- Mini Polisaj Makinesi Uyumlu,MG PS,530,https://mgpolishing.com/wp-content/uploads/2025/11/GPRO4535_0.jpg,AKSESUAR,Polisaj Pedleri ve Keçeler,Orbital Süngerler,"Araç boyası - en dar alanlar, ayna kenarları, kapı kolları, spoiler detayları",MG PADS Her Polisaj Makinasına Uyumlu Rotary Orbital Pasta Hare Hologram Süngerleri Cila Pedleri Yetkili Türkiye Dağıtıcısı. Güvenli Alışveriş. Hızlı Kargo,polisher_machine,mini_cordless_polisher
BUR045,8683492660475,MG PS Kalın Pasta Süngeri Flat (Bordo) 45 mm - Mini Polisaj Makinesi Uyumlu,MG PS,120,https://mgpolishing.com/wp-content/uploads/2025/11/BUR045_0.jpg,AKSESUAR,Polisaj Pedleri ve Keçeler,Rotary Süngerler,"Araç boyası - düz dar alanlar, kapı kenarları, bagaj çizgileri",MG PADS Avrupa Üretimi Rotary Orbital Pasta Hare Hologram Süngerleri Cila Pedleri Yetkili Türkiye Dağıtıcısı. Orijinal Ürün Garantisi. Ücretsiz Kargo.,polisher_machine,mini_cordless_polisher
GPRO045,8683492660499,MG PS Hare/Hologram Giderici Cila Süngeri Flat (Sarı) 45mm - Mini Polisaj Makinesi Uyumlu,MG PS,120,https://mgpolishing.com/wp-content/uploads/2025/11/GPRO045_0.jpg,AKSESUAR,Polisaj Pedleri ve Keçeler,Rotary Süngerler,"Araç boyası - düz dar alanlar, kapı kenarları, bagaj çizgileri",MG PADS Her Polisaj Makinasına Uyumlu Rotary Orbital Pasta Hare Hologram Süngerleri Cila Pedleri Yetkili Türkiye Dağıtıcısı. Güvenli Alışveriş. Hızlı Kargo,polisher_machine,mini_cordless_polisher
336807,4030293129054,FLEX Polisaj Makinesi Yedek Kömür Takımı L48 (2 Adet),FLEX,850,https://mgpolishing.com/wp-content/uploads/2025/11/336807_0.jpg,MAKİNE-EKİPMAN,Yedek Parçalar,,FLEX L48 serisi polisaj makineleri,"FLEX Rotary ve Orbital Polisaj Makinesi Yedek Kömür Takımı L48, düşük kıvılcım ve uzun ömürlü kullanım sağlar. Orijinal karbon kömür ile motor performansınızı ilk günkü gibi yenileyin.",spare_part,carbon_brush
399647,4030293169920,FLEX Polisaj Makinesi Yedek Kömür Takımı K96 (2 Adet),FLEX,750,https://mgpolishing.com/wp-content/uploads/2025/11/399647_0.jpg,MAKİNE-EKİPMAN,Yedek Parçalar,,FLEX K96 serisi polisaj makineleri,"FLEX Rotary ve Orbital Polisaj Makinesi Yedek Kömür Takımı K96, düşük kıvılcım ve yüksek dayanım sunar. Orijinal yedek parça ile motor performansını yenileyin, uzun ömürlü kullanım sağlayın.",spare_part,carbon_brush
81676800,8414685032546,"IK FOAM 1,5 ve FOAM PRO 2 için Yedek Köpük Yapıcı Nozzle ve Keçe Kiti - 3 Parça",IK SPRAYERS,420,https://mgpolishing.com/wp-content/uploads/2025/11/81676800_0.jpg,MAKİNE-EKİPMAN,Yedek Parçalar,,IK FOAM serisi köpük pompası makineleri,"IK FOAM 1,5 ve FOAM PRO 2 için yedek nozzle ve keçe kiti ile püskürtücünüzün performansını koruyun. 3 parçalık set sayesinde kesintisiz, güçlü ve etkili köpük püskürtme!",spare_part,maintenance_kit
81771871,8414685032539,IK MULTI 1.5 ve MULTI PRO 2 için Yedek Nozzle Kiti - 2 Parça,IK SPRAYERS,450,https://mgpolishing.com/wp-content/uploads/2025/11/81771871_0.jpg,MAKİNE-EKİPMAN,Yedek Parçalar,,IK MULTI serisi basınçlı pompa makineleri,"IK FOAM 1,5 ve FOAM PRO 2 için yedek nozzle ve keçe kiti ile püskürtücünüzün performansını koruyun. 2 parçalık set sayesinde kesintisiz, güçlü ve etkili köpük püskürtme!",spare_part,nozzle_kit
81771874,8414685032614,IK MULTI ve PRO 2 için Yedek Bakım Kiti - 6 Parça,IK SPRAYERS,350,https://mgpolishing.com/wp-content/uploads/2025/11/81771874_0.jpg,MAKİNE-EKİPMAN,Yedek Parçalar,,IK MULTI ve FOAM 1.5 litre kapasiteli pompalar,"IK MULTI ve PRO 2 modelleri için 6 parçalık yedek bakım kiti ile püskürtücünüzün ömrünü uzatın. Kolay montaj, maksimum performans!",spare_part,maintenance_kit
82671874,8414685032607,IK MULTI 6-9-12 ve MULTI PRO 9-12 için Yedek Bakım Kiti - 9 Parça,IK SPRAYERS,620,https://mgpolishing.com/wp-content/uploads/2025/11/82671874_0.jpg,MAKİNE-EKİPMAN,Yedek Parçalar,,"IK MULTI 6, 9 ve 12 litre kapasiteli basınçlı pompalar","Pompa yedek parça, şişe yedek parça, Aside dayanıklı sprey şişe, basınçlı sprey püskürtücü, kimyasala dayanıklı şişe, solvente dayanıklı şişe, köpük yapan pompa, köpük yapıcı şişe, alkali dayanıklı pompa, IK sprey, IK köpük, IK pompa, IK sprayerS",spare_part,maintenance_kit
487953,4030293219519,FLEX XCE/XFE Orbital Polisaj Makineleri Uyumlu Velcro Taban 125mm,FLEX,1600,https://mgpolishing.com/wp-content/uploads/2025/11/487953_0.jpg,MAKİNE-EKİPMAN,Ped Destek Diskleri Tabanlıklar,,FLEX XCE ve XFE orbital polisaj makineleri,"FLEX XCE/XFE 125 mm velcro taban, orbital polisaj makineleri için ideal yedek parça. Esnek PU yapısı ve özel vidalama sistemiyle uzun ömürlü, güvenli ve dengeli polisaj deneyimi sağlar.",spare_part,backing_plate
487988,4030293219533,FLEX XCE/XFE Orbital Polisaj Makineleri Uyumlu Velcro Taban 150mm,FLEX,1450,https://mgpolishing.com/wp-content/uploads/2025/11/487988_0.jpg,MAKİNE-EKİPMAN,Ped Destek Diskleri Tabanlıklar,,FLEX XCE ve XFE orbital polisaj makineleri,"FLEX XCE/XFE orbital polisaj makineleri için uyumlu 150 mm Velcro taban, esnek PU malzeme ve özel vidalama sistemiyle dayanıklı ve güvenli kullanım sağlar. Profesyoneller için ideal.",spare_part,backing_plate
492353,4030293222120,FLEX BP-M D30 - PXE 80 İçin Cırtlı Tabanlık 30 mm / 1 inc,FLEX,750,https://mgpolishing.com/wp-content/uploads/2025/08/492353_1.webp,MAKİNE-EKİPMAN,Ped Destek Diskleri Tabanlıklar,,FLEX PXE 80 nano polisaj makinesi,"FLEX BP-M D30, yalnızca FLEX PXE 80 ile uyumlu 30 mm cırtlı tabanlık. Orta sertlikte PU malzeme, hassas polisaj ve detay işlemleri için ideal profesyonel destek diski.",spare_part,backing_plate
509248,4030293232761,FLEX BP-M D50 - PXE 80 İçin Cırtlı Tabanlık 50 mm / 2 inc,FLEX,990,https://mgpolishing.com/wp-content/uploads/2025/11/509248_0.jpg,MAKİNE-EKİPMAN,Ped Destek Diskleri Tabanlıklar,,FLEX PXE 80 nano polisaj makinesi,"FLEX BP-M D50, yalnızca FLEX PXE 80 ile uyumlu 50 mm cırtlı tabanlık. Orta sertlikte PU malzeme, hassas polisaj ve detay işlemleri için ideal yedek ped destek diski.",spare_part,backing_plate
492361,4030293222144,FLEX BP-M D75 - PXE 80 İçin Cırtlı Tabanlık 75 mm / 3 inc,FLEX,950,https://mgpolishing.com/wp-content/uploads/2025/11/492361_0.jpg,MAKİNE-EKİPMAN,Ped Destek Diskleri Tabanlıklar,,FLEX PXE 80 nano polisaj makinesi,"FLEX BP-M D75, PXE 80 polisaj makinesi için özel 75 mm cırtlı tabanlık. Orta sert PU yapısı sayesinde hassas detay işlemlerinde stabil ve güvenli polisaj deneyimi sunar.",spare_part,backing_plate
SGGD166,8683492660864,SGCB Mini Polisaj Makinesi Tabanlık Seti 2 Adet,SGCB,550,https://mgpolishing.com/wp-content/uploads/2025/11/SGGD166_0.jpg,MAKİNE-EKİPMAN,Ped Destek Diskleri Tabanlıklar,,SGCB mini polisaj makinesi aparatı,"SGCB Mini Polisaj Makinesi Tabanlık Seti, 15mm ve 25mm boyutlarında 2 yedek tabanlık içerir. Detaylı polisaj uygulamaları için ideal orijinal yedek parçadır!",spare_part,backing_plate
SGGF181-57,8683492661830,SGCB Orbital Polisaj Makinesi Tabanı 125mm 5” – Cırtlı Delikli,SGCB,1050,https://mgpolishing.com/wp-content/uploads/2025/08/SGGF181-57_1.webp,MAKİNE-EKİPMAN,Yedek Parçalar,,SGCB SGGF181 kodlu orbital polisaj makineleri,"SGCB Orbital Polisaj Makinesi Tabanı 125mm, cırtlı ve delikli tasarımıyla pedleri serin tutar, sabit ve dengeli polisaj sağlar. SGCB SGGF181 modeliyle 0 uyumludur!",spare_part,backing_plate
SGGD051,4713435113660,SGCB Rotary Esnek Silikon Pad Destek Tabanı 5''/125 mm,SGCB,470,https://mgpolishing.com/wp-content/uploads/2025/11/SGGD051_0.jpg,MAKİNE-EKİPMAN,Ped Destek Diskleri Tabanlıklar,,M14 dişli tüm rotary polisaj makineleri,"SGCB Rotary Esnek Silikon Pad Destek Tabanı 125mm, M14 uyumlu yapısıyla sünger ve keçeleri sabit tutar. Kıvrımlı yüzeylerde güvenli ve dengeli polisaj sağlar!",spare_part,backing_plate
SGGD053,6973086160309,SGCB Rotary Esnek Silikon Pad Destek Tabanı 6''/150 mm,SGCB,490,https://mgpolishing.com/wp-content/uploads/2025/11/SGGD053_0.jpg,MAKİNE-EKİPMAN,Ped Destek Diskleri Tabanlıklar,,M14 dişli tüm rotary polisaj makineleri,"SGCB Rotary Esnek Silikon Pad Destek Tabanı 150mm, M14 uyumlu yapısıyla sünger ve keçeleri sabit tutar. Kıvrımlı yüzeylerde güvenli ve dengeli polisaj sağlar!",spare_part,backing_plate
