sku,barcode,product_name,brand,price,image_url,main_cat,sub_cat,sub_cat2,target_surface,short_description,template_group,template_sub_type
75130,8027486750016,"FRA-BER Reef Marin, Tekne Krom Ve Çelik Parçalar İçin Pas Ve Kireç Çözücü - 750 ml",FRA-BER,370,https://mgpolishing.com/wp-content/uploads/2025/11/75130_0.jpg,MARİN,Temizlik Ürünleri,Yağ-Kir çözücüler,"Krom korkuluklar, paslanmaz çelik merdivenler, direkler, roll-barlar, pasarellalar, ankrajlar, su hattı",İtalyan FRA-BER Premium Profesyonel Marin Tekne Yat Yıkama Temizlik ve Bakım Ürünleri Yetkili Türkiye Distribütörü MTS Kimya’da. Orijinal Ürün Garantisi.,marin_products,water_spot_remover
75131,8027486750023,"FRA-BER Tritone Tekne, Bot, Fiberglass İçin Yağ Çözme Etkili Yüzey Plastik Temizleyici - 750 ml",FRA-BER,360,https://mgpolishing.com/wp-content/uploads/2025/06/75131.jpg,MARİN,Temizlik Ürünleri,Genel Kullanım,"Fiberglas gövde, PVC/hypalon bot tüpleri, vinil döşemeler, motor bölmesi, egzoz çıkışı",İtalyan FRA-BER Premium Profesyonel Marin Tekne Yat Yıkama Temizlik ve Bakım Ürünleri Yetkili Türkiye Distribütörü MTS Kimya’da. Orijinal Ürün Garantisi.,marin_products,iron_remover
24.011.261.080,4260063011061,"MENZERNA Marin, Tekne Gelcoat Boya 3in1 Tek Adım Pasta Cila Koruma - 1 lt",MENZERNA,2900,https://mgpolishing.com/wp-content/uploads/2025/11/24011.261.080_0.jpg,MARİN,Pasta Cila Ürünleri,,"Tekne gövdesi, jelkot (gelcoat) yüzeyler",Menzerna Marin Yat Tekne Pasta Cila Ürünlerini Menzerna Yetkili Türkiye Dağıtıcısı MTS Kimya Güvencesi ile Satın Alın. Orijinal Ürün Garantisi.,marin_products,one_step_polish
75112,8027486749829,"FRA-BER Fiocco Marin, Tekne Alkol Bazlı Genel Yüzey Temizleyici (1:15 Konsantre) - 5 kg",FRA-BER,1300,https://mgpolishing.com/wp-content/uploads/2025/11/75112_0.jpg,MARİN,Temizlik Ürünleri,Genel Kullanım,"Mobilyalar, zeminler, kapı/pencere çerçeveleri, tekne yüzeyleri, alüminyum, plastik",İtalyan FRA-BER Premium Profesyonel Marin Tekne Yat Yıkama Temizlik ve Bakım Ürünleri Yetkili Türkiye Distribütörü MTS Kimya’da. Orijinal Ürün Garantisi.,marin_products,interior_detailer
701283,8027486816798,"FRA-BER WC KEM Taşınabilir Tuvaletler, Karavanlar ve Tekneler İçin Gider Temizleyici ve Açıcı– 1 Lt",FRA-BER,380,https://mgpolishing.com/wp-content/uploads/2025/08/701283_1.webp,MARİN,Temizlik Ürünleri,Genel Kullanım,"Ev tipi tuvaletler, portatif tuvalet kabinleri, karavan/motokaravan tuvaletleri, tekne tuvaletleri, otobüs/tren tuvaletleri",İtalyan FRA-BER Premium Profesyonel Marin Tekne Yat Yıkama Temizlik ve Bakım Ürünleri Yetkili Türkiye Distribütörü MTS Kimya’da. Orijinal Ürün Garantisi.,marin_products,interior_detailer
MT12450M,5023555108309,Q1 Premium Maskeleme Bantı Sarı - 24mm x 50 metre,Q1 TAPES,75,https://mgpolishing.com/wp-content/uploads/2025/11/MT12450M_0.jpg,AKSESUAR,Maskeleme Bantları,,"Boyalı yüzeyler, vernik, maskeleme kağıdı, koruyucu film",Q1 Maskeleme Bantları Premium Yapışkan Süngerleri Yetkili Türkiye Dağıtıcısı MTS Kimya’dan Satın Alın. Orijinal Ürün Garantisi. Aynı Gün Ücretsiz Kargo.,masking_tapes,premium_tape
MT11850M,5023555108316,Q1 Premium Maskeleme Bantı Sarı - 18mm x 50 metre,Q1 TAPES,60,https://mgpolishing.com/wp-content/uploads/2025/11/MT11850M_0.jpg,AKSESUAR,Maskeleme Bantları,,"Boyalı yüzeyler, vernik, maskeleme kağıdı, koruyucu film",Q1 Maskeleme Bantları Premium Yapışkan Süngerleri Yetkili Türkiye Dağıtıcısı MTS Kimya’dan Satın Alın. Orijinal Ürün Garantisi. Aynı Gün Ücretsiz Kargo.,masking_tapes,premium_tape
MT13650M,5023555108293,Q1 Premium Maskeleme Bantı Sarı - 36mm x 50 metre,Q1 TAPES,115,https://mgpolishing.com/wp-content/uploads/2025/11/MT13650M_0.jpg,AKSESUAR,Maskeleme Bantları,,"Boyalı yüzeyler, vernik, maskeleme kağıdı, koruyucu film",Q1 Maskeleme Bantları Premium Yapışkan Süngerleri Yetkili Türkiye Dağıtıcısı MTS Kimya’dan Satın Alın. Orijinal Ürün Garantisi. Aynı Gün Ücretsiz Kargo.,masking_tapes,premium_tape
MT14850M,5023555108286,Q1 Premium Maskeleme Bantı Sarı - 48mm x 50 metre,Q1 TAPES,140,https://mgpolishing.com/wp-content/uploads/2025/11/MT14850M_0.jpg,AKSESUAR,Maskeleme Bantları,,"Boyalı yüzeyler, vernik, maskeleme kağıdı, koruyucu film",Q1 Maskeleme Bantları Premium Yapışkan Süngerleri Yetkili Türkiye Dağıtıcısı MTS Kimya’dan Satın Alın. Orijinal Ürün Garantisi. Aynı Gün Ücretsiz Kargo.,masking_tapes,premium_tape
HPG11850M,5023555110258,Q1 Yüksek Performans Maskeleme Bantı Yeşil - 18mm x 50 metre,Q1 TAPES,100,https://mgpolishing.com/wp-content/uploads/2025/11/HPG11850M_0.jpg,AKSESUAR,Maskeleme Bantları,,"Boyalı yüzeyler, kavisli paneller, düz olmayan yüzeyler",Q1 Maskeleme Bantları Premium Yapışkan Süngerleri Yetkili Türkiye Dağıtıcısı MTS Kimya’dan Satın Alın. Orijinal Ürün Garantisi. Aynı Gün Ücretsiz Kargo.,masking_tapes,high_performance_tape
TT01T10M,5023555108200,Q1 Premium Trim Maskeleme Bantı Rulo - 10mm x 10metre,Q1 TAPES,629,https://mgpolishing.com/wp-content/uploads/2025/11/TT01T10M_0.jpg,AKSESUAR,Maskeleme Bantları,,"Trim parçaları, kapı kolları, pervazlar, far üniteleri, stop lambaları",Q1 Maskeleme Bantları Premium Yapışkan Süngerleri Yetkili Türkiye Dağıtıcısı MTS Kimya’dan Satın Alın. Orijinal Ürün Garantisi. Aynı Gün Ücretsiz Kargo.,masking_tapes,trim_tape
Q2M-MT6X18M,8809432678182,GYEON QM MaskingTape Maskeleme Bandı 6 mm x 18 metre - 20'li Paket -İz Yapışkan Bırakmaz,GYEON,2600,https://mgpolishing.com/wp-content/uploads/2025/08/Q2M-MT6X18M_1.webp,AKSESUAR,Maskeleme Bantları,,"Trim kenarları, plastik parçalar, kaplama sınırları, polisaj maskeleme","GYEON Maskeleme Bandı 6mm x 18m: Yapışkan izi bırakmaz, hassas uygulamalar için ideal. MTS Kimya güvencesiyle orijinal ürün ve aynı gün kargo fırsatı.",masking_tapes,detailing_tape
Q2M-SDE7090C,8809432671480,GYEON QM SilkDryer EVO İnovatif Kurulama Havlusu - 70x90 cm,GYEON,1100,https://mgpolishing.com/wp-content/uploads/2025/08/Q2M-SDE7090C_1.webp,AKSESUAR,Mikrofiber Ürünler,Kurulama Havluları,"Boya, cam, PPF, jant, piano-black, trim","GYEON QM SilkDryer EVO 70x90 cm: İnovatif tasarımıyla yüksek emicilik sunan kurulama havlusu. MTS Kimya güvencesiyle orijinal ürün, aynı gün kargo fırsatı.",microfiber,drying_towel
Q2M-SDE5055C,8809432671473,GYEON QM SilkDryer EVO İnovatif Kurulama Havlusu - 50x55 cm,GYEON,660,https://mgpolishing.com/wp-content/uploads/2025/11/Q2M-SDE5055C_0.png,AKSESUAR,Mikrofiber Ürünler,Kurulama Havluları,"Boya, cam, PPF, jant, piano-black, trim",GYEON QM SilkDryer EVO 50x55 cm: İnovatif tasarımıyla mükemmel emicilik sağlayan kurulama havlusu.,microfiber,drying_towel
3213EMR,,KLIN Drying DUO EVO Çift Taraflı Mikro Kurulama Havlusu (Kırmızı) - 75x43cm,KLIN,780,,AKSESUAR,Mikrofiber Ürünler,Kurulama Havluları,"Otomotiv, motor, marin yüzeyleri",KLIN Dünya’nın En İyi Dayanıklı Mikrofiber Araç Pasta Cila Silme Bezleri Türkiye Yetkili Dağıtıcı MTS Kimya. Satın Al. Orijinal Ürün. Hızlı Kargo.,microfiber,drying_towel
Q2M-SODE6080C,8809432671435,GYEON QM Soft Dryer EVO Lazer Kesim Peluş Kurulama Havlusu - 60x80 cm,GYEON,620,https://mgpolishing.com/wp-content/uploads/2025/11/Q2M-SODE6080C_0.jpg,AKSESUAR,Mikrofiber Ürünler,Kurulama Havluları,"Hassas boya, yumuşak vernik, koyu renk araçlar","GYEON QM Soft Dryer EVO 60x80 cm: Lazer kesim peluş kurulama havlusu, mükemmel emicilik ve hassas temizlik sağlar.",microfiber,drying_towel
3215D,8809512170445,KLIN Buffing King Çift Taraflı Peluş Cila Silme Bezi 1000 GSM - 45x37cm,KLIN,470,https://mgpolishing.com/wp-content/uploads/2025/08/3215D_1.webp,AKSESUAR,Mikrofiber Ürünler,Silme Bezleri,"Dış paneller, wax/cila uygulanmış yüzeyler, iç aksam, ev eşyaları",KLIN Dünya’nın En İyi Dayanıklı Mikrofiber Araç Pasta Cila Silme Bezleri Türkiye Yetkili Dağıtıcı MTS Kimya. Satın Al. Orijinal Ürün. Hızlı Kargo.,microfiber,buffing_cloth
Q2M-SWE4040C,8809432671374,GYEON QM SoftWipe EVO Lazer Kesim Peluş Pasta Cila Bezi - 40x40 cm,GYEON,280,https://mgpolishing.com/wp-content/uploads/2025/11/Q2M-SWE4040C_0.jpg,AKSESUAR,Mikrofiber Ürünler,Silme Bezleri,"Hassas boyalar, kaplama/koruma uygulanan yüzeyler","GYEON QM SoftWipe EVO 40x40 cm: Lazer kesim peluş pasta cila bezi, mükemmel sonuçlar için tasarlandı. MTS Kimya güvencesiyle orijinal ürün, aynı gün kargo fırsatı.",microfiber,buffing_cloth
Q2M-PWE4040C,8809432671442,GYEON QM PolishWipe EVO Lazer Kesim Çift Yönlü Cila Bezi - 40x40 cm,GYEON,260,https://mgpolishing.com/wp-content/uploads/2025/11/Q2M-PWE4040C_0.jpg,AKSESUAR,Mikrofiber Ürünler,Silme Bezleri,"Boya, krom, parlak nikel, alüminyum, piano-black, plastik trim","GYEON QM PolishWipe EVO 40x40 cm: Lazer kesim çift yönlü cila bezi, mükemmel sonuçlar için tasarlandı. MTS Kimya güvencesiyle orijinal ürün, aynı gün kargo avantajı.",microfiber,buffing_cloth
Q2M-BWE4040,8809432671381,GYEON QM Baldwipe EVO Lazer Kesim Tüysüz Çok Amaçlı Mikrofiber Bez - 40x40 cm,GYEON,240,https://mgpolishing.com/wp-content/uploads/2025/11/Q2M-BWE4040_0.jpg,AKSESUAR,Mikrofiber Ürünler,Silme Bezleri,"Boya, kaplama uygulanan yüzeyler, iç aksam","GYEON QM BaldWipe EVO 40x40 cm: Lazer kesim tüysüz çok amaçlı mikrofiber bez, pratik ve etkili temizlik için idealdir. MTS Kimya güvencesiyle orijinal ürün, aynı gün kargo avantajı.",microfiber,coating_cloth
3217HS-5G,8683492660635,KLIN Zero Finish HD Mikrofiber Lazer Kesim Çok Amaçlı Silme Bez 5'li Paket (Gri) - 40x40cm,KLIN,800,https://mgpolishing.com/wp-content/uploads/2025/08/3217HS-5G_1.webp,AKSESUAR,Mikrofiber Ürünler,Silme Bezleri,"Dış yüzeyler, iç aksam, ev eşyaları, elektronik ürünler",KLIN Dünya’nın En İyi Dayanıklı Mikrofiber Araç Pasta Cila Silme Bezleri Türkiye Yetkili Dağıtıcı MTS Kimya. Satın Al. Orijinal Ürün. Hızlı Kargo.,microfiber,multi_purpose_cloth
Q2M-STE,8809432674856,GYEON QM Smoothie EVO Mikrofiber Araç Yıkama Eldiveni,GYEON,1100,https://mgpolishing.com/wp-content/uploads/2025/11/Q2M-STE_0.jpg,AKSESUAR,Mikrofiber Ürünler,Yıkama Eldivenleri ve Süngerleri,"Boya, cam, PPF, seramik kaplamalı yüzeyler","GYEON QM Smoothie EVO: Mikrofiber araç yıkama eldiveni, üst düzey temizlik ve hassasiyet sağlar. Yüzeylere zarar vermez.",microfiber,wash_mitt
3221A-RD,,KLIN Wash Mitt Mikrofiber Araç Yıkama Eldiveni (Kırmızı) - 20x18 cm,KLIN,620,,AKSESUAR,Mikrofiber Ürünler,Yıkama Eldivenleri ve Süngerleri,"Araç boya yüzeyleri, cam, motosiklet, marin",KLIN Dünya’nın En İyi Dayanıklı Mikrofiber Araç Yıkama Eldivenleri Pedleri Türkiye Yetkili Dağıtıcı MTS Kimya. Satın Al. Orijinal Ürün. Hızlı Kargo.,microfiber,wash_mitt
3227I-HD,8809512170841,KLIN Softy HD Wash Mitt Ultra Yumuşak Uzun Tüylü Mikrofiber Araç Yıkama Eldiveni (Açık Bej) - 23x16 cm,KLIN,480,https://mgpolishing.com/wp-content/uploads/2025/08/3227I-HD_1.webp,AKSESUAR,Mikrofiber Ürünler,Yıkama Eldivenleri ve Süngerleri,"Hassas boyalar, seramik kaplamalı yüzeyler, PPF, premium araçlar",KLIN Dünya’nın En İyi Dayanıklı Mikrofiber Araç Yıkama Eldivenleri Pedleri Türkiye Yetkili Dağıtıcı MTS Kimya. Satın Al. Orijinal Ürün. Hızlı Kargo.,microfiber,wash_mitt
Q2M-WME,8809432671367,GYEON QM Wheelmitt EVO Jantlara Özel Dayanıklı Yıkama Eldiveni - 1250 GSM,GYEON,1100,https://mgpolishing.com/wp-content/uploads/2025/11/Q2M-WME_0.jpg,AKSESUAR,Mikrofiber Ürünler,Yıkama Eldivenleri/Süngerleri,"Jantlar (boyalı, krom, kaplamalı, seramik kaplı), fren kaliperleri, egzoz uçları","GYEON QM Wheelmitt EVO: Jant yıkama eldiveni, etkili ve pratik temizlik sağlar. Yüzeylere zarar vermeden derinlemesine temizlik için idealdir.",microfiber,wash_mitt
Q2M-GWE4040,8809432675709,GYEON QM GlassWipe EVO Cam Temizlik Bezi - 40x40 cm,GYEON,330,https://mgpolishing.com/wp-content/uploads/2025/11/Q2M-GWE4040_0.jpg,AKSESUAR,Mikrofiber Ürünler,Silme Bezleri,"Cam, ayna, ekran, vitrin, pencere","GYEON QM GlassWipe EVO 40x40 cm: Cam yüzeyler için özel temizlik bezi, streaksız ve parlak sonuçlar sağlar.",microfiber,glass_cloth
3218,,KLIN Glass Shine Cam Silme Bezi - 60x30 cm,KLIN,220,,AKSESUAR,Mikrofiber Ürünler,Silme Bezleri,"Cam, ayna, parlak yüzeyler",KLIN KOREA Dünya’nın En Büyük Mikrofiber Bez Üreticisi Ürünleri Türkiye’de. Yetkili Dağıtıcı MTS Kimya’dan İncele Satın Al. Aynı Gün Ücretsiz Kargo.,microfiber,glass_cloth
Q2M-WD4040C,8809432676195,GYEON QM Waffle Dryer Petek Dokulu Cam Silme Bezi Ve Yüzey Kurulama Havlusu - 40x40 cm,GYEON,220,https://mgpolishing.com/wp-content/uploads/2025/08/Q2M-WD4040C_1.webp,AKSESUAR,Mikrofiber Ürünler,Kurulama Havluları,"Cam, ayna, boyalı yüzey, plastik aksam, ekran","GYEON QM Waffle Dryer 40x40 cm: Petek dokulu cam silme bezi ve yüzey kurulama havlusu, mükemmel emicilikle temizliği kolaylaştırır. MTS Kimya güvencesiyle orijinal ürün, aynı gün kargo.",microfiber,glass_cloth
Q2M-IWE40402P,8809432675730,GYEON QM InteriorWipe EVO İç Yüzey Detaylı Temizlik Bezi 2'li Paket - 40x40 cm,GYEON,500,https://mgpolishing.com/wp-content/uploads/2025/11/Q2M-IWE40402P_0-scaled.jpg,AKSESUAR,Mikrofiber Ürünler,Silme Bezleri,"Plastik, trim, dashboard, konsol, iç aksam","GYEON QM InteriorWipe EVO 40x40 cm: etkili ve pratik kullanımla temizlik sağlar. MTS Kimya güvencesiyle orijinal ürün, aynı gün kargo.",microfiber,interior_cloth
Q2M-LWE40402P,8809432675723,GYEON QM LeatherWipe EVO Deri Aksamlara Özel Temizleme Bezi 2'li Paket - 40x40 cm,GYEON,400,https://mgpolishing.com/wp-content/uploads/2025/11/Q2M-LWE40402P_0.jpg,AKSESUAR,Mikrofiber Ürünler,Silme Bezleri,"Deri koltuk, deri döşeme, Alcantara","GYEON QM LeatherWipe EVO 40x40 cm: Deri aksamlara özel temizlik için 2'li paket, etkili ve nazik bakım sağlar.",microfiber,interior_cloth
Q2M-SEP1010C,8809432671497,GYEON QM Suede EVO Seramik Uygulamaları İçin Süet Silme Bezi 1010cm - 10 lu Paket,GYEON,350,https://mgpolishing.com/wp-content/uploads/2025/11/Q2M-SEP1010C_0.jpg,AKSESUAR,Mikrofiber Ürünler,Silme Bezleri,Seramik kaplama uygulanan yüzeyler,"Seramik uygulamaları için özel süet silme bezi, 10'lu paket. Hassas ve etkili temizlik sunar. MTS Kimya güvencesiyle orijinal ürün, aynı gün kargo.",microfiber,suede_cloth
KLIN-3113AG,8683492660956,KLIN Clean Towel Çok Amaçlı Silme Ve Temizlik Bezi 10'lu Paket (Gri) - 40x40cm,KLIN,1000,https://mgpolishing.com/wp-content/uploads/2025/08/KLIN-3113AG_1.webp,AKSESUAR,Mikrofiber Ürünler,Silme Bezleri,"Araç, ev eşyaları, elektronik ürünler, değerli parçalar",KLIN Dünya’nın En İyi Dayanıklı Mikrofiber Temizlik Bezleri Türkiye Yetkili Dağıtıcı MTS Kimya’dan İncele Satın Al. Orijinal Ürün Garantisi. Hızlı Kargo,microfiber,multi_purpose_cloth
Q2M-IPE4P,8809432675747,GYEON QM InteriorPack EVO İç Aksam Mikrofiber Detaylı Temizlik Bezi Seti 4'lü Paket - 40x40 cm,GYEON,880,https://mgpolishing.com/wp-content/uploads/2025/11/Q2M-IPE4P_0-scaled.jpg,AKSESUAR,Mikrofiber Ürünler,Silme Bezleri,"İç konsol, torpido, plastik, cam, ayna, deri, Alcantara","İç aksamlar için mikrofiber detaylı temizlik bezleri, etkili ve pratik temizlik sunar. MTS Kimya güvencesiyle orijinal ürün, aynı gün kargo fırsatı.",microfiber,kit
Q2M-GPE2P,8809432675716,GYEON QM GlassPack EVO Cam Yüzey Temizlik ve Silme Mikrofiber Bezi Seti 2'lü Paket - 40x40 cm,GYEON,500,https://mgpolishing.com/wp-content/uploads/2025/11/Q2M-GPE2P_0-scaled.jpg,AKSESUAR,Mikrofiber Ürünler,Silme Bezleri,"Cam, ayna, koruma uygulanan yüzeyler","GYEON QM GlassPack EVO 2'li Paket 40x40 cm: Cam yüzey temizlik ve silme için mikrofiber bez seti, etkili ve streaksız sonuçlar sağlar.",microfiber,kit
Q2M-WP,8809432671053,GYEON QM Wash Pad Çift Yüzlü Araç Yıkama Eldiveni - Washpad Mikrofiber Eldiven,GYEON,900,https://mgpolishing.com/wp-content/uploads/2025/11/Q2M-WP_0.jpg,AKSESUAR,Mikrofiber Ürünler,Yıkama Eldivenleri ve Süngerleri,Araç boya yüzeyleri,"GYEON QM Wash Pad: Çift yüzlü araç yıkama eldiveni, etkili temizlik ve kolay kullanım sunar. Yüzeylere zarar vermeden derinlemesine temizlik sağlar.",microfiber,wash_mitt
3215ZB,,KLIN Çok Amaçlı Lazer Kesim Çift Taraflı Cila Bezi 320 GSM - 2'li Paket - 40x40 cm,KLIN,390,,AKSESUAR,Mikrofiber Ürünler,Silme Bezleri,"Dış paneller, cila/wax uygulanan yüzeyler",KLIN Dünya’nın En İyi Dayanıklı Mikrofiber Araç Pasta Cila Silme Bezleri Türkiye Yetkili Dağıtıcı MTS Kimya. Satın Al. Orijinal Ürün. Hızlı Kargo.,microfiber,buffing_cloth
3217HS-5W,8683492660659,KLIN Zero Finish HD Mikrofiber Lazer Kesim Çok Amaçlı Silme Bez 5'li Paket (Beyaz) - 40x40cm,KLIN,800,https://mgpolishing.com/wp-content/uploads/2025/08/3217HS-5W_1.webp,AKSESUAR,Mikrofiber Ürünler,Silme Bezleri,"Dış yüzeyler, iç aksam, ev eşyaları, elektronik ürünler",KLIN Dünya’nın En İyi Dayanıklı Mikrofiber Araç Pasta Cila Silme Bezleri Türkiye Yetkili Dağıtıcı MTS Kimya. Satın Al. Orijinal Ürün. Hızlı Kargo.,microfiber,multi_purpose_cloth
3218-1,8809512170780,KLIN Glass Shine HD Çift Taraflı Cam Silme Bezi - 30x40 cm,KLIN,370,https://mgpolishing.com/wp-content/uploads/2025/08/3218-1_1.webp,AKSESUAR,Mikrofiber Ürünler,Silme Bezleri,"Cam, ayna, parlak yüzeyler",KLIN KOREA Dünya’nın En Büyük Mikrofiber Bez Üreticisi Ürünleri Türkiye’de. Yetkili Dağıtıcı MTS Kimya’dan İncele Satın Al. Aynı Gün Ücretsiz Kargo.,microfiber,glass_cloth
Q2M-WD4060C,8809432676201,GYEON QM Waffle Dryer Petek Dokulu Cam Silme Bezi Ve Yüzey Kurulama Havlusu - 40x60 cm,GYEON,280,https://mgpolishing.com/wp-content/uploads/2025/11/Q2M-WD4060C_0.jpg,AKSESUAR,Mikrofiber Ürünler,Kurulama Havluları,"Cam, ayna, boyalı yüzey, plastik aksam, ekran","GYEON QM Waffle Dryer 40x60 cm: Petek dokulu cam silme bezi ve yüzey kurulama havlusu, yüksek emicilikle etkili temizlik sunar. MTS Kimya güvencesiyle orijinal ürün, aynı gün kargo fırsatı.",microfiber,glass_cloth
3225A-BL,,KLIN Wash Pad Araç Yıkama Padi (Mavi) - 25x15 cm,KLIN,580,,AKSESUAR,Mikrofiber Ürünler,Yıkama Eldivenleri ve Süngerleri,"Araç boya yüzeyleri, cam",KLIN Dünya’nın En İyi Dayanıklı Mikrofiber Araç Yıkama Eldivenleri Pedleri Türkiye Yetkili Dağıtıcı MTS Kimya. Satın Al. Orijinal Ürün. Hızlı Kargo.,microfiber,wash_mitt
3227B,8809512170650,KLIN Softy Mitt Yumuşak Tüylü Araç Yıkama Eldiveni (Siyah) - 20x16 cm,KLIN,460,https://mgpolishing.com/wp-content/uploads/2025/08/3227B_1.webp,AKSESUAR,Mikrofiber Ürünler,Yıkama Eldivenleri ve Süngerleri,"Hassas boyalar, seramik kaplamalı yüzeyler, premium araçlar",KLIN Dünya’nın En İyi Dayanıklı Mikrofiber Araç Yıkama Eldivenleri Pedleri Türkiye Yetkili Dağıtıcı MTS Kimya. Satın Al. Orijinal Ürün. Hızlı Kargo.,microfiber,wash_mitt
3228R,8809512170643,KLIN Softy Wash Pad Yumuşak Tüylü Araç Yıkama Padi (Kırmızı) - 22x14 cm,KLIN,400,https://mgpolishing.com/wp-content/uploads/2025/08/3228R_1.webp,AKSESUAR,Mikrofiber Ürünler,Yıkama Eldivenleri ve Süngerleri,"Hassas boyalar, premium araçlar",KLIN Dünya’nın En İyi Dayanıklı Mikrofiber Araç Yıkama Eldivenleri Pedleri Türkiye Yetkili Dağıtıcı MTS Kimya. Satın Al. Orijinal Ürün. Hızlı Kargo.,microfiber,wash_mitt
70919,8027486709199,FRA-BER Sentetik Güderi Bez Süper Kurulama Bezi 300 gr - 54x44 cm,FRA-BER,450,https://mgpolishing.com/wp-content/uploads/2025/11/70919_0.jpg,AKSESUAR,Mikrofiber Ürünler,Silme Bezleri,"Araç boyası, cam, plastik, ev yüzeyleri, tekne",İtalyan FRA-BER 1. Kalite Mikrofiber ve Güderi Bez Yetkili Türkiye Distribütörü MTS Kimya’da. Orijinal Ürün Garantisi. Aynı Gün Hızlı Kargo.,microfiber,chamois_drying_towel
3219,8809512170377,KLIN Green Monster Zorlu Yağ/Kir İçin Temizlik Bezi - 40x36 cm,KLIN,220,https://mgpolishing.com/wp-content/uploads/2025/08/3219_1.webp,AKSESUAR,Mikrofiber Ürünler,Silme Bezleri,"Jantlar, motor bölmesi, lastikler, motorsikletler, ATV'ler",KLIN KOREA Dünya’nın En Büyük Mikrofiber Bez Üreticisi Ürünleri Türkiye’de. Yetkili Dağıtıcı MTS Kimya’dan İncele Satın Al. Aynı Gün Ücretsiz Kargo.,microfiber,cleaning_cloth
3236NBR2,8809512170872,KLIN Deri Ve Plastik Yüzeyler İçin Çift Taraflı Araç İçi Temizlik Aplikatörü Scrubpad 2'li Paket,KLIN,420,https://mgpolishing.com/wp-content/uploads/2025/08/3236NBR2_1.webp,AKSESUAR,Uygulama Aplikatörleri,,"Deri koltuklar, plastik trim, dashboard, kapı panelleri, ulaşılması zor alanlar",KLIN Dünya’nın En İyi Dayanıklı Mikrofiber Araç Yıkama Eldivenleri Pedleri Türkiye Yetkili Dağıtıcı MTS Kimya. Satın Al. Orijinal Ürün. Hızlı Kargo.,microfiber,interior_cleaning_applicator
26.900.224.010,4260063012280,MENZERNA Ağır Kesim Pasta Süngeri (Kırmızı) - 150mm,MENZERNA,900,https://mgpolishing.com/wp-content/uploads/2025/11/26900.224.010_0.jpg,AKSESUAR,Polisaj Pedleri ve Keçeler,Orbital Süngerler,"Otomotiv boyası, vernik, sert vernikler, far plastikleri",Menzerna Pedler Sünger ve Keçeleri Yetkili Türkiye Dağıtıcısı MTS Kimya Güvencesi ile Satın Alın. Hızlı Kargo. Güvenli Alışveriş. Orijinal Ürün Garantisi.,polishing_pad,foam_pad
26.900.224.011,4260063012297,MENZERNA İnce Kesim Pasta Süngeri (Sarı) - 150mm,MENZERNA,900,https://mgpolishing.com/wp-content/uploads/2025/11/26900.224.011_0.jpg,AKSESUAR,Polisaj Pedleri ve Keçeler,Orbital Süngerler,"Otomotiv boyası, vernik, orta sertlikteki vernikler",Menzerna Pedler Sünger ve Keçeleri Yetkili Türkiye Dağıtıcısı MTS Kimya Güvencesi ile Satın Alın. Hızlı Kargo. Güvenli Alışveriş. Orijinal Ürün Garantisi.,polishing_pad,foam_pad
26.900.224.012,4260063012303,MENZERNA Hare Giderici Cila Süngeri (Yeşil) - 150mm,MENZERNA,900,https://mgpolishing.com/wp-content/uploads/2025/11/26900.224.012_0.jpg,AKSESUAR,Polisaj Pedleri ve Keçeler,Orbital Süngerler,"Otomotiv boyası, vernik, tüm boya tipleri, hassas yüzeyler",Menzerna Pedler Sünger ve Keçeleri Yetkili Türkiye Dağıtıcısı MTS Kimya Güvencesi ile Satın Alın. Hızlı Kargo. Güvenli Alışveriş. Orijinal Ürün Garantisi.,polishing_pad,foam_pad
26.907.099.001,4260063014826,MENZERNA Ağır Kesim Kalın Pasta Süngeri 2li Paket (Kırmızı) - 95mm,MENZERNA,900,https://mgpolishing.com/wp-content/uploads/2025/11/26907.099.001_0.jpg,AKSESUAR,Polisaj Pedleri ve Keçeler,Rotary Süngerler,"Otomotiv boyası, vernik, dar alanlar, köşeler, kenarlar",Menzerna Pedler Sünger ve Keçeleri Yetkili Türkiye Dağıtıcısı MTS Kimya Güvencesi ile Satın Alın. Hızlı Kargo. Güvenli Alışveriş. Orijinal Ürün Garantisi.,polishing_pad,foam_pad
26.908.099.001,4260063014833,MENZERNA İnce Kesim Ara Kat Pasta Süngeri 2li Paket (Sarı) - 95mm,MENZERNA,900,https://mgpolishing.com/wp-content/uploads/2025/11/26908.099.001_0.jpg,AKSESUAR,Polisaj Pedleri ve Keçeler,Rotary Süngerler,"Otomotiv boyası, vernik, dar alanlar, köşeler, kenarlar",Menzerna Pedler Sünger ve Keçeleri Yetkili Türkiye Dağıtıcısı MTS Kimya Güvencesi ile Satın Alın. Hızlı Kargo. Güvenli Alışveriş. Orijinal Ürün Garantisi.,polishing_pad,foam_pad
26.909.099.001,4260063014840,MENZERNA Hare Hologram Giderici Cila Süngeri 2li Paket (Yeşil) - 95mm,MENZERNA,900,https://mgpolishing.com/wp-content/uploads/2025/11/26909.099.001_0.jpg,AKSESUAR,Polisaj Pedleri ve Keçeler,Rotary Süngerler,"Otomotiv boyası, vernik, dar alanlar, köşeler, hassas bölgeler",Menzerna Pedler Sünger ve Keçeleri Yetkili Türkiye Dağıtıcısı MTS Kimya Güvencesi ile Satın Alın. Hızlı Kargo. Güvenli Alışveriş. Orijinal Ürün Garantisi.,polishing_pad,foam_pad
26.900.223.003,4260063011610,MENZERNA P150M Hare Giderici Cila Süngeri (Sarı) - 150mm,MENZERNA,300,https://mgpolishing.com/wp-content/uploads/2025/11/26900.223.003_0.jpg,AKSESUAR,Polisaj Pedleri ve Keçeler,Rotary Süngerler,"Otomotiv boyası, vernik, tüm boya tipleri",Menzerna Pedler Sünger ve Keçeleri Yetkili Türkiye Dağıtıcısı MTS Kimya Güvencesi ile Satın Alın. Hızlı Kargo. Güvenli Alışveriş. Orijinal Ürün Garantisi.,polishing_pad,foam_pad
26.914.099.001,4260063017162,"MENZERNA Premium Orbital Kuzu Yünü Polisaj Keçesi 140 mm/5,5&quot;",MENZERNA,350,https://mgpolishing.com/wp-content/uploads/2025/08/26914.099.001_1.webp,AKSESUAR,Polisaj Pedleri ve Keçeler,Keçeler,"Otomotiv boyası, vernik, sert vernikler, far plastikleri",Yetkili Türkiye Dağıtıcısı MTS Kimya Güvencesi ile Satın Alın. Hızlı Kargo. Güvenli Alışveriş. Orijinal Ürün Garantisi.,polishing_pad,wool_pad
26.906.099.001,4260063017100,MENZERNA Krater Kuzu Yünü Polisaj Keçesi 230mm/9 inc,MENZERNA,720,https://mgpolishing.com/wp-content/uploads/2025/11/26906.099.001_0.jpg,AKSESUAR,Polisaj Pedleri ve Keçeler,Keçeler,"Otomotiv boyası, vernik, geniş düz paneller",Menzerna Pedler Sünger ve Keçeleri Yetkili Türkiye Dağıtıcısı MTS Kimya Güvencesi ile Satın Alın. Hızlı Kargo. Güvenli Alışveriş. Orijinal Ürün Garantisi.,polishing_pad,wool_pad
26.915.099.001,4260063017186,"MENZERNA Premium Orbital Kuzu Yünü Polisaj Keçesi 165mm/6,5&quot;",MENZERNA,400,https://mgpolishing.com/wp-content/uploads/2025/11/26915.099.001_0.jpg,AKSESUAR,Polisaj Pedleri ve Keçeler,Keçeler,"Otomotiv boyası, vernik, sert vernikler, far plastikleri",Yetkili Türkiye Dağıtıcısı MTS Kimya Güvencesi ile Satın Alın. Hızlı Kargo. Güvenli Alışveriş. Orijinal Ürün Garantisi.,polishing_pad,wool_pad
